run_date,server_key,retailer_id,branch_id,timeframe_start,timeframe_end,num_types,total_quantity,avg_net_revenue,avg_profit,new_product_revenue,top_product_quantity,top_sale_by_quantity,top_return_by_quantity,top_rev_by_quantity,top_profit_by_quantity,top_product_rev,top_sale_by_rev,top_return_by_rev,top_rev_by_rev,top_profit_by_rev,top_product_profit,top_sale_by_profit,top_return_by_profit,top_rev_by_profit,top_profit_by_profit,last_product_quantity,last_sale_by_quantity,last_return_by_quantity,last_rev_by_quantity,last_profit_by_quantity,last_product_rev,last_sale_by_rev,last_return_by_rev,last_rev_by_rev,last_profit_by_rev,last_product_profit,last_sale_by_profit,last_return_by_profit,last_rev_by_profit,last_profit_by_profit,top_group_quantity,group_sale_by_quantity,group_return_by_quantity,group_rev_by_quantity,group_profit_by_quantity,top_group_rev,group_sale_by_rev,group_return_by_rev,group_rev_by_rev,group_profit_by_rev,top_group_profit,group_sale_by_profit,group_return_by_profit,group_rev_by_profit,group_profit_by_profit,last_group_quantity,last_group_sale_quantity,last_group_return_quantity,last_group_rev_quantity,last_group_profit_quantity,last_group_rev,last_group_sale_rev,last_group_return_rev,last_group_rev_rev,last_group_profit_rev,last_group_profit,last_group_sale_profit,last_group_return_profit,last_group_rev_profit,last_group_profit_profit,timeframe_type
2025-04-10,111,285727,54778,2025-03-11,2025-04-10,555,4130.29,12844.4,2074.79,,"[""Khẩu trang 3D PALMY Hộp 50 chiếc + Khẩu trang 5D MASK DUY KHÁNH hộp 100 chiếc (Ngần) (Chiếc)"",""Bluego + Zilgo - Tấm nhỏ 3 chiếc hộp 34 tấm - băng dán cá nhân (Tín Phong) (Tấm)"",""BCS Doku bạc + Doku màu hộp 10 chiếc (Chiếc)"",""Viên kẹo ngậm Smart life (Việt Đức) (Viên)"",""Găng tay VGlove XANH LÁ hộp 50 đôi - 100 chiếc (Đôi)"",""HTT - Yumagel dạ dày (HN) (Gói)"",""HTT - Tiffy hộp 25 vỉ (HN) (Vỉ)"",""Tetracyclin 250mg (Viên)"",""HTT - Men vi sinh Enterogermina hộp 20 ống (HN) (DKSH) (Ống)"",""HTT - Kẹo dẻo Ích Nhi (Nam Dược) + Bipp Gummy Calci (Gói)""]","[212.0,163.0,140.0,136.0,126.0,106.0,96.0,80.0,68.0,61.0]","[0.0,0.0,0.0,0.0,0.0,0.0,0.0,0.0,0.0,0.0]","[169600.0,163000.0,980000.0,90712.0,189000.0,522600.0,480000.0,32000.0,575282.0,458000.0]","[42400.0,43195.0,588000.0,31824.0,50400.0,49800.0,159360.0,17440.0,65282.0,61500.0]","[""HTT - Coveram 5/5 (HN) (Lọ)"",""BCS Doku bạc + Doku màu hộp 10 chiếc (Chiếc)"",""HTT - Say xe Hàn hộp 30 lọ (CL) (Chai)"",""HTT - Hoạt huyết nhất nhất (Hộp)"",""HTT - Neo Tergynan đặt phụ khoa (HN) (Việt Hà) (Hộp)"",""Quick stick - Test thử thai (HN) (Chiếc)"",""HTT - Men vi sinh Enterogermina hộp 20 ống (HN) (DKSH) (Ống)"",""HTT - Prospan siro ho TE (Sohaco) (Chai)"",""Franlucat 10 hộp 4 vỉ x 7 viên / Montelukast 10mg (Eloge) (Vỉ)"",""Bảo Khí Khang Hộp dạng vỉ 20 viên (Fobic) (Hộp)""]","[5.0,140.0,40.0,6.0,4.0,29.0,68.0,7.0,8.0,3.0]","[0.0,0.0,0.0,0.0,0.0,0.0,0.0,0.0,0.0,0.0]","[1200000.0,980000.0,799685.0,690000.0,680000.0,579685.0,575282.0,572689.0,560000.0,555000.0]","[75000.0,588000.0,293005.0,90000.0,204000.0,173685.0,65282.0,65539.0,232000.0,45000.0]","[""BCS Doku bạc + Doku màu hộp 10 chiếc (Chiếc)"",""HTT - Say xe Hàn hộp 30 lọ (CL) (Chai)"",""DDVS CANIZASS chai 200 ml có VÒI (Santafa) (Chai)"",""Franlucat 10 hộp 4 vỉ x 7 viên / Montelukast 10mg (Eloge) (Vỉ)"",""Alphawin New hộp 10 vỉ (Hàng tích điểm tặng quà) Win Pharma (Vỉ)"",""Maxxskin 10g kem bôi 3 thành phần (ĐNA) + Genprozol (VCP) (Tuýp)"",""HTT - Neo Tergynan đặt phụ khoa (HN) (Việt Hà) (Hộp)"",""Sâm kỳ vương hộp 4 viên (A Việt) (Viên)"",""CALI 600 - Calcium 600 + Vitamin D lọ 30 viên USA (Nam Hà) (Lọ)"",""Quick stick - Test thử thai (HN) (Chiếc)""]","[140.0,40.0,4.0,8.0,30.0,10.0,4.0,9.0,1.0,29.0]","[0.0,0.0,0.0,0.0,0.0,0.0,0.0,0.0,0.0,0.0]","[980000.0,799685.0,360000.0,560000.0,539717.0,500000.0,680000.0,540000.0,190000.0,579685.0]","[588000.0,293005.0,244000.0,232000.0,217217.0,214400.0,204000.0,202500.0,190000.0,173685.0]","[""Vương lão kiện (AA) (Hộp)"",""CELL SKIN hỗ trợ lông tóc móng hộp 60 viên hộp 12 vỉ (S) (Hộp)"",""Kiện Cốt Vương hộp 2 vỉ (CVI) (Hộp)"",""Pymetphage 850 - Metfomin (Pymephaco) (Vỉ)"",""Salonpas hộp 20m dán - HỘP TO có 10h nhỏ (Hộp)"",""Bình rửa mũi xoang Ích Nhân (Bình)"",""Cris Sharvin dùng cho u xơ (A Việt) (Hộp)"",""Eugica xịt họng lọ 10ml (Mega) (Lọ)"",""Viên ngậm Smart life dạng vỉ hộp 2 vỉ (Việt Đức) (Vỉ)"",""Tinfocold lọ 90ml (Tín Phong) (Chai)""]","[0.15000000000000002,0.166,0.2,0.5,0.5,0.5,0.72,1.0,1.0,1.0]","[0.0,0.0,0.0,0.0,0.0,0.0,0.0,0.0,0.0,0.0]","[27750.0,49800.0,37200.0,12500.0,13500.0,25000.0,54000.0,55000.0,20000.0,35000.0]","[0.0,33200.0,2000.0,0.0,2000.0,5000.0,3600.0,10000.0,5300.0,5000.0]","[""Fungi SH shower & shapoo lọ 100 ml nấm ngứa (S) (Lọ)"",""Acnevir Santafa ĐỎ tuýp bôi mụn đầu đen, mụn đầu trắng (Santafa) (Tuýp)"",""Amivita Plus bổ sung vitamin hộp 4 vỉ (Tcophar) (Vỉ)"",""GSV Passion dùng trong mụn cóc, mụn cơm (Lọ)"",""Trà LẠC TIÊN LAVA giúp ngủ ngon (S) (Hộp)"",""Miếng dán giảm đau con HỔ túi 10 miếng (Miếng)"",""REDWIN Vitamin E kem bôi dưỡng da (S) (Hộp)"",""SRM Decumar Advance anti-acne 50g (CVI) (Lọ)"",""DHA Healthy Care lọ 60 viên nhai hàng Úc (HNg) (Lọ)"",""Fluopas (Tuýp)""]","[1.0,3.0,4.0,2.0,2.0,21.0,1.0,2.0,1.0,8.0]","[0.0,0.0,0.0,0.0,0.0,0.0,0.0,0.0,0.0,0.0]","[0.0,0.0,0.0,0.0,0.0,0.0,0.0,0.0,0.0,0.0]","[-36000.0,-186000.0,-85000.0,-218000.0,-78000.0,-69300.0,-66500.0,-133000.0,-130000.0,-32000.0]","[""HTT - Diane 35 nội tiết (HN) (Hộp)"",""HTT - KS Zitromax/Azitromycin 500mg vỉ 3 viên (HN) (Zuellig) (Hộp)"",""Estinfo bổ sung nội tiết tố (Tín Phong) (Hộp)"",""Fitobimbi Immuno tăng đề kháng (A.N) (Chai)"",""Center GOLD xuyên tâm liên hộp 3 vỉ (D) (Vỉ)"",""GSV Passion dùng trong mụn cóc, mụn cơm (Lọ)"",""Fish Oil 1000mg hộp100 viên MEGA WE CARE (Hộp)"",""Acnevir Santafa ĐỎ tuýp bôi mụn đầu đen, mụn đầu trắng (Santafa) (Tuýp)"",""Ostelin Kids Calci & Vitamin D3 lọ 90 viên (HN) (Hộp)"",""HTT - Berlthyrox / Natri Levothyroxine 100mcg hộp 4 vỉ (HN) (Việt Hà) (Zuelig) (Vỉ)""]","[5.0,2.0,1.0,1.0,7.0,2.0,1.0,3.0,1.0,13.0]","[0.0,0.0,0.0,0.0,0.0,0.0,0.0,0.0,0.0,0.0]","[0.0,0.0,0.0,0.0,0.0,0.0,0.0,0.0,0.0,25000.0]","[-560000.0,-540000.0,-477272.0,-285000.0,-223615.0,-218000.0,-194925.0,-186000.0,-185000.0,-178450.0]","[""HÀNG THÔNG THƯỜNG"",""Vật tư vật dụng y tế"",""THỰC PHẨM CHỨC NĂNG"",""Thuốc đường hô hấp - ho cảm"",""Mỹ phẩm chăm sóc da, Dầu gội, KĐR...."",""Thuốc Kháng Sinh"",""Thuốc Đường Tiêu Hóa"",""Thuốc Giảm đau + Hạ sốt"",""Thuốc Tuýp"",""Vitamin và khoáng chất""]","[1286.0,1071.416,331.65,264.0,188.72,170.0,134.0,128.0,90.0,78.0]","[0.0,0.0,0.0,0.0,0.0,0.0,0.0,0.0,0.0,0.0]","[1.9066596E7,4907720.0,6769778.0,2128855.0,4303967.0,1386881.0,1029910.0,1140000.0,2264370.0,527688.0]","[2071515.0,1705974.0,-24186.400000000023,620392.0,564008.0,397906.0,271408.0,435694.0,325356.0,46468.0]","[""HÀNG THÔNG THƯỜNG"",""THỰC PHẨM CHỨC NĂNG"",""Vật tư vật dụng y tế"",""Mỹ phẩm chăm sóc da, Dầu gội, KĐR...."",""Thuốc Tuýp"",""Thuốc đường hô hấp - ho cảm"",""Thuốc Phụ Khoa"",""Thuốc Kháng Sinh"",""Thuốc Giảm đau + Hạ sốt"",""Thuốc Đường Tiêu Hóa""]","[1286.0,331.65,1071.416,188.72,90.0,264.0,62.0,170.0,128.0,134.0]","[0.0,0.0,0.0,0.0,0.0,0.0,0.0,0.0,0.0,0.0]","[1.9066596E7,6769778.0,4907720.0,4303967.0,2264370.0,2128855.0,1387685.0,1386881.0,1140000.0,1029910.0]","[2071515.0,-24186.400000000023,1705974.0,564008.0,325356.0,620392.0,504015.0,397906.0,435694.0,271408.0]","[""HÀNG THÔNG THƯỜNG"",""Vật tư vật dụng y tế"",""Thuốc đường hô hấp - ho cảm"",""Mỹ phẩm chăm sóc da, Dầu gội, KĐR...."",""Thuốc Phụ Khoa"",""Thuốc Giảm đau + Hạ sốt"",""Thuốc Kháng Sinh"",""TPCN BỔ NÃO - TĂNG ĐỀ KHÁNG - MẮT"",""Thuốc Tuýp"",""TPCN Dung dịch vệ sinh""]","[1286.0,1071.416,264.0,188.72,62.0,128.0,170.0,16.0,90.0,8.0]","[0.0,0.0,0.0,0.0,0.0,0.0,0.0,0.0,0.0,0.0]","[1.9066596E7,4907720.0,2128855.0,4303967.0,1387685.0,1140000.0,1386881.0,814000.0,2264370.0,552000.0]","[2071515.0,1705974.0,620392.0,564008.0,504015.0,435694.0,397906.0,336500.0,325356.0,292000.0]","[""Thuốc Tiêm Truyền"",""TPCN BỔ THẬN - TIỀN LIỆT - U XƠ "",""TPCN CANXI - KHỚP"",""TPCN LÀM ĐẸP + VITAMIN"",""Sữa rửa mặt"",""Thực phẩm chức năng cho bé"",""Thuốc Da Liễu"",""TPCN Dung dịch vệ sinh"",""Thuốc Đông Dược"",""Thuốc Huyết Áp - Tim Mạch - Đường huyết""]","[1.0,1.0,3.0,3.0,4.0,5.0,7.0,8.0,8.0,8.0]","[0.0,0.0,0.0,0.0,0.0,0.0,0.0,0.0,0.0,0.0]","[15000.0,350000.0,300000.0,240000.0,290000.0,400000.0,220000.0,552000.0,426000.0,394000.0]","[1000.0,50000.0,108000.0,84600.0,-73000.0,30000.0,-67459.0,292000.0,69300.0,15500.0]","[""Thuốc Tiêm Truyền"",""Thuốc đường huyết"",""Thuốc Tuần Hoàn Não"",""Thuốc Da Liễu"",""XỊT MŨI HỌNG, RĂNG MIỆNG, VIÊN NGẬM"",""TPCN LÀM ĐẸP + VITAMIN"",""Sữa rửa mặt"",""TPCN CANXI - KHỚP"",""Thuốc Kháng Virus - Kháng Nấm"",""TPCN BỔ THẬN - TIỀN LIỆT - U XƠ ""]","[1.0,9.5,11.0,7.0,19.0,3.0,4.0,3.0,17.0,1.0]","[0.0,0.0,0.0,0.0,0.0,0.0,0.0,0.0,0.0,0.0]","[15000.0,66500.0,165000.0,220000.0,239831.0,240000.0,290000.0,300000.0,338000.0,350000.0]","[1000.0,0.0,56282.0,-67459.0,84661.0,84600.0,-73000.0,108000.0,58660.0,50000.0]","[""Sữa rửa mặt"",""Thuốc Da Liễu"",""Thuốc Mắt - Mũi - Tai"",""THỰC PHẨM CHỨC NĂNG"",""Thuốc đường huyết"",""Thuốc Tiêm Truyền"",""Thuốc Huyết Áp - Tim Mạch - Đường huyết"",""Thực phẩm chức năng cho bé"",""Vitamin và khoáng chất"",""TPCN BỔ THẬN - TIỀN LIỆT - U XƠ ""]","[4.0,7.0,60.0,331.65,9.5,1.0,8.0,5.0,78.0,1.0]","[0.0,0.0,0.0,0.0,0.0,0.0,0.0,0.0,0.0,0.0]","[290000.0,220000.0,890000.0,6769778.0,66500.0,15000.0,394000.0,400000.0,527688.0,350000.0]","[-73000.0,-67459.0,-60140.0,-24186.400000000023,0.0,1000.0,15500.0,30000.0,46468.0,50000.0]",30 ngày gần nhất
2025-04-10,111,285727,54778,2025-04-01,2025-04-10,249,1176.0,11866.67,3236.16,,"[""Găng tay VGlove XANH LÁ hộp 50 đôi - 100 chiếc (Đôi)"",""HTT - Yumagel dạ dày (HN) (Gói)"",""HTT - Mezapulgit dạ dày hộp 30 gói (HN) (Gói)"",""HTT - Kẹo dẻo Ích Nhi (Nam Dược) + Bipp Gummy Calci (Gói)"",""HTT - Tiffy hộp 25 vỉ (HN) (Vỉ)"",""HTT - Men vi sinh Enterogermina hộp 20 ống (HN) (DKSH) (Ống)"",""Say xe Thái vỉ 10 viên ( YB ) (Viên)"",""HTT - Gạc răng miệng Dr. Papie (TPC) (Miếng)"",""BCS Doku bạc + Doku màu hộp 10 chiếc (Chiếc)"",""Bơm 1 hộp 100 chiếc (TQ) (Cái)""]","[106.0,64.0,40.0,35.0,30.0,30.0,30.0,30.0,30.0,24.0]","[0.0,0.0,0.0,0.0,0.0,0.0,0.0,0.0,0.0,0.0]","[159000.0,320000.0,120000.0,250000.0,150000.0,255000.0,30000.0,120000.0,210000.0,19200.0]","[42400.0,32000.0,64000.0,22500.0,49800.0,30000.0,18300.0,30990.0,126000.0,3120.0]","[""HTT - Neo Tergynan đặt phụ khoa (HN) (Việt Hà) (Hộp)"",""EVADAYS viên đặt âm đạo, phụ khoa hộp 10 viên (ĐNA) (Hộp)"",""HTT - Yumagel dạ dày (HN) (Gói)"",""Quick stick - Test thử thai (HN) (Chiếc)"",""HTT - Men vi sinh Enterogermina hộp 20 ống (HN) (DKSH) (Ống)"",""HTT - Kẹo dẻo Ích Nhi (Nam Dược) + Bipp Gummy Calci (Gói)"",""Viên nang giải rượu Nam Dược BYESAY hộp to - 5 hộp nhỏ (Hộp nhỏ)"",""HTT - Hapenxin 500mg xanh tím DHG (Vỉ)"",""BCS Doku bạc + Doku màu hộp 10 chiếc (Chiếc)"",""Cao An Thanh (Nam Dược) (Chai)""]","[4.0,5.0,64.0,13.0,30.0,35.0,11.0,12.0,30.0,3.0]","[0.0,0.0,0.0,0.0,0.0,0.0,0.0,0.0,0.0,0.0]","[680000.0,350000.0,320000.0,260000.0,255000.0,250000.0,242000.0,216000.0,210000.0,195000.0]","[204000.0,148750.0,32000.0,78000.0,30000.0,22500.0,77000.0,52704.0,126000.0,0.0]","[""HTT - Neo Tergynan đặt phụ khoa (HN) (Việt Hà) (Hộp)"",""EVADAYS viên đặt âm đạo, phụ khoa hộp 10 viên (ĐNA) (Hộp)"",""BCS Doku bạc + Doku màu hộp 10 chiếc (Chiếc)"",""Quick stick - Test thử thai (HN) (Chiếc)"",""Viên nang giải rượu Nam Dược BYESAY hộp to - 5 hộp nhỏ (Hộp nhỏ)"",""BenoBoston - Betamethasone + Dexchlorpheniramin hộp 10 vỉ Boston (Vỉ)"",""SCABE SH CREAM kem bôi trị kí sinh trùng (S) (Tuýp)"",""SRM Skin GSV 300ml (S) (Chai)"",""EYE Omega Bổ mắt Hộp 50 viên (Việt Pháp) (Hộp)"",""HTT - Mezapulgit dạ dày hộp 30 gói (HN) (Gói)""]","[4.0,5.0,30.0,13.0,11.0,5.0,1.0,2.0,1.0,40.0]","[0.0,0.0,0.0,0.0,0.0,0.0,0.0,0.0,0.0,0.0]","[680000.0,350000.0,210000.0,260000.0,242000.0,100000.0,120000.0,190000.0,158000.0,120000.0]","[204000.0,148750.0,126000.0,78000.0,77000.0,75000.0,75000.0,70000.0,66000.0,64000.0]","[""Bình rửa mũi xoang Ích Nhân (Bình)"",""Salonpas hộp 20m dán - HỘP TO có 10h nhỏ (Hộp)"",""Tẩy tế bào chết Lô hội + Thảo dược (Dabo) (Hộp)"",""Kem nẻ Valentine ( Thái Dương ) (Tuýp)"",""Ravonol - Para + Lora + Dextro cảm cúm, ho hộp 10 vỉ (Trường Thọ) (Vỉ)"",""Vitamin E kem bôi hũ trắng nắp xanh hàng Thái (Hũ)"",""Towder Spray - Pemethrin 5% dạng xịt (S) (Chai)"",""KĐR Bee trẻ em (NH) (tuýp)"",""An Trĩ Vương Gel (Tuýp)"",""FOBE Mouth Ulcer gel nhiệt miệng chai 15g (FOBELIFE) (Chai)""]","[0.5,0.5,1.0,1.0,1.0,1.0,1.0,1.0,1.0,1.0]","[0.0,0.0,0.0,0.0,0.0,0.0,0.0,0.0,0.0,0.0]","[25000.0,13500.0,145000.0,30000.0,12000.0,28000.0,150000.0,40000.0,92590.0,70000.0]","[5000.0,2000.0,29000.0,5000.0,6500.0,10000.0,50000.0,7000.0,3490.0,30000.0]","[""Bơm 3 hộp 100 chiếc (TQ) (Cái)"",""Cedetamin (Viên) lọ 500 viên (Viên)"",""Metronidazol Hà Tây hộp 50 vỉ (HN) (Vỉ)"",""Bơm 5 hộp 100 chiếc (TQ) (Cái)"",""HTT - Gạc tiệt trùng 30 x 30cm vải xô ( CTD ) (Gói)"",""Napharangan - Paracetamol sủi hộp 16 viên (Nam Hà) (Vỉ)"",""Acetab + Hapacol 325 - Paracetamol 325mg vỉ 10 viên (AH) (Vỉ)"",""Cốm Canxi (Lọ)"",""HTT - Sedachor hộp 25 vỉ + PASEPAN hộp 50 vỉ (HT) (Vỉ)"",""HTT - Dep nước (TQ) (HN) (Lọ)""]","[1.0,6.0,1.0,5.0,1.0,2.0,1.0,1.0,2.0,1.0]","[0.0,0.0,0.0,0.0,0.0,0.0,0.0,0.0,0.0,0.0]","[1000.0,3000.0,3500.0,4000.0,4000.0,5000.0,5000.0,6000.0,6000.0,6000.0]","[440.0,2280.0,830.0,1100.0,2000.0,2286.0,2920.0,2500.0,1000.0,2300.0]","[""Cao An Thanh (Nam Dược) (Chai)"",""Chất xơ Ích Nhi (Nam Dược) (Gói)"",""Bơm 3 hộp 100 chiếc (TQ) (Cái)"",""Metronidazol Hà Tây hộp 50 vỉ (HN) (Vỉ)"",""TraSleepy dưỡng tâm an thần hộp 2 vỉ (TPC) (Vỉ)"",""HTT - Hoạt Huyết Dưỡng Não hộp 5 vỉ (TPC) (Vỉ)"",""HTT - Sedachor hộp 25 vỉ + PASEPAN hộp 50 vỉ (HT) (Vỉ)"",""Bơm 5 hộp 100 chiếc (TQ) (Cái)"",""Chubby kids hộp 20 ống (D) (Ống)"",""HTT - Natri 0.9% Traphaco + Nam Hà (Hộp)""]","[3.0,14.0,1.0,1.0,1.0,1.0,2.0,5.0,5.0,7.0]","[0.0,0.0,0.0,0.0,0.0,0.0,0.0,0.0,0.0,0.0]","[195000.0,77000.0,1000.0,3500.0,23000.0,19000.0,6000.0,4000.0,32500.0,28000.0]","[0.0,0.0,440.0,830.0,1000.0,1000.0,1000.0,1100.0,1250.0,1400.0]","[""HÀNG THÔNG THƯỜNG"",""Vật tư vật dụng y tế"",""THỰC PHẨM CHỨC NĂNG"",""Thuốc Giảm đau + Hạ sốt"",""Mỹ phẩm chăm sóc da, Dầu gội, KĐR...."",""Thuốc Đường Tiêu Hóa"",""Thuốc đường hô hấp - ho cảm"",""Thuốc Phụ Khoa"",""Thuốc chống viêm corticoid + alpha"",""Thuốc Mắt - Mũi - Tai""]","[433.0,350.0,99.0,47.0,39.0,36.0,28.0,25.0,20.0,17.0]","[0.0,0.0,0.0,0.0,0.0,0.0,0.0,0.0,0.0,0.0]","[5737000.0,1206700.0,1636500.0,378000.0,1166590.0,432410.0,353000.0,777000.0,202000.0,299000.0]","[1207230.0,462173.0,398725.0,188246.0,363856.0,101476.0,124420.0,281210.0,77560.0,52360.0]","[""HÀNG THÔNG THƯỜNG"",""THỰC PHẨM CHỨC NĂNG"",""Vật tư vật dụng y tế"",""Mỹ phẩm chăm sóc da, Dầu gội, KĐR...."",""Thuốc Phụ Khoa"",""Thuốc Tuýp"",""Thuốc Đường Tiêu Hóa"",""Thuốc Giảm đau + Hạ sốt"",""Thuốc đường hô hấp - ho cảm"",""Thuốc Mắt - Mũi - Tai""]","[433.0,99.0,350.0,39.0,25.0,16.0,36.0,47.0,28.0,17.0]","[0.0,0.0,0.0,0.0,0.0,0.0,0.0,0.0,0.0,0.0]","[5737000.0,1636500.0,1206700.0,1166590.0,777000.0,440000.0,432410.0,378000.0,353000.0,299000.0]","[1207230.0,398725.0,462173.0,363856.0,281210.0,112218.0,101476.0,188246.0,124420.0,52360.0]","[""HÀNG THÔNG THƯỜNG"",""Vật tư vật dụng y tế"",""THỰC PHẨM CHỨC NĂNG"",""Mỹ phẩm chăm sóc da, Dầu gội, KĐR...."",""Thuốc Phụ Khoa"",""Thuốc Giảm đau + Hạ sốt"",""Thuốc đường hô hấp - ho cảm"",""Thuốc Tuýp"",""Thuốc Đường Tiêu Hóa"",""TPCN Dung dịch vệ sinh""]","[433.0,350.0,99.0,39.0,25.0,47.0,28.0,16.0,36.0,2.0]","[0.0,0.0,0.0,0.0,0.0,0.0,0.0,0.0,0.0,0.0]","[5737000.0,1206700.0,1636500.0,1166590.0,777000.0,378000.0,353000.0,440000.0,432410.0,150000.0]","[1207230.0,462173.0,398725.0,363856.0,281210.0,188246.0,124420.0,112218.0,101476.0,79000.0]","[""Thực phẩm chức năng cho bé"",""Thuốc Đông Dược"",""Sữa rửa mặt"",""Thuốc Huyết Áp - Tim Mạch - Đường huyết"",""TPCN Dung dịch vệ sinh"",""Thuốc Kháng Virus - Kháng Nấm"",""TPCN BỔ NÃO - TĂNG ĐỀ KHÁNG - MẮT"",""XỊT MŨI HỌNG, RĂNG MIỆNG, VIÊN NGẬM"",""Thuốc Khác (Gout, Giãn cơ, Tẩy giun...)"",""Vitamin và khoáng chất""]","[1.0,1.0,1.0,1.0,2.0,3.0,3.0,5.0,5.0,6.0]","[0.0,0.0,0.0,0.0,0.0,0.0,0.0,0.0,0.0,0.0]","[100000.0,9000.0,145000.0,17000.0,150000.0,55000.0,191000.0,50000.0,75000.0,35000.0]","[40000.0,4400.0,30000.0,3200.0,79000.0,14250.0,73800.0,20400.0,12669.0,14580.0]","[""Thuốc Đông Dược"",""Thuốc Huyết Áp - Tim Mạch - Đường huyết"",""Vitamin và khoáng chất"",""XỊT MŨI HỌNG, RĂNG MIỆNG, VIÊN NGẬM"",""Thuốc Kháng Virus - Kháng Nấm"",""Thuốc Khác (Gout, Giãn cơ, Tẩy giun...)"",""Thực phẩm chức năng cho bé"",""Thuốc Tuần Hoàn Não"",""Thuốc Nội tiết + Phụ Khoa"",""Thuốc kháng histamin""]","[1.0,1.0,6.0,5.0,3.0,5.0,1.0,7.0,9.0,14.0]","[0.0,0.0,0.0,0.0,0.0,0.0,0.0,0.0,0.0,0.0]","[9000.0,17000.0,35000.0,50000.0,55000.0,75000.0,100000.0,105000.0,111500.0,137000.0]","[4400.0,3200.0,14580.0,20400.0,14250.0,12669.0,40000.0,35000.0,22920.0,38600.0]","[""Thuốc Huyết Áp - Tim Mạch - Đường huyết"",""Thuốc Đông Dược"",""Thuốc Khác (Gout, Giãn cơ, Tẩy giun...)"",""Thuốc Kháng Virus - Kháng Nấm"",""Vitamin và khoáng chất"",""XỊT MŨI HỌNG, RĂNG MIỆNG, VIÊN NGẬM"",""Thuốc Nội tiết + Phụ Khoa"",""Sữa rửa mặt"",""Thuốc Tuần Hoàn Não"",""Thuốc kháng histamin""]","[1.0,1.0,5.0,3.0,6.0,5.0,9.0,1.0,7.0,14.0]","[0.0,0.0,0.0,0.0,0.0,0.0,0.0,0.0,0.0,0.0]","[17000.0,9000.0,75000.0,55000.0,35000.0,50000.0,111500.0,145000.0,105000.0,137000.0]","[3200.0,4400.0,12669.0,14250.0,14580.0,20400.0,22920.0,30000.0,35000.0,38600.0]",tháng này
